{
  "$schema": "./new-api-production-readiness.schema.json",
  "version": 1,
  "objective": "Reach 100% public New API route compatibility while keeping Elygate PostgreSQL-native and Redis-free until every tracked capability meets production-ready gates.",
  "sourceSnapshot": {
    "project": "QuantumNous/new-api",
    "commit": "6c35e1ef2671be8bd3c230882e4ff5a885e89c57",
    "checkedAt": "2026-06-27",
    "evidence": [
      "README.zh_CN.md:186-224",
      "README.zh_CN.md:259-287",
      "README.zh_CN.md:300-321",
      "README.zh_CN.md:400-406",
      "controller/*",
      "relay/*",
      "router/*"
    ]
  },
  "productionDefinition": [
    "Implemented in the Elygate stack without replacing Bun/Elysia/PostgreSQL.",
    "Every public New API route surface remains client-compatible without requiring New API runtime internals.",
    "No default Redis server, Redis client, Redis queue, or Redis cache dependency.",
    "PostgreSQL schema and migration path are explicit when persistence changes.",
    "Automated local tests cover request shape, response shape, error behavior, billing/logging side effects, and rollback where applicable.",
    "Runtime smoke exists for database-backed or async behavior.",
    "User-facing admin or enterprise UI is covered by typecheck and route/UI smoke when the feature has a UI.",
    "Production deployment readiness requires a documented target profile, secrets checklist, migration plan, backup/restore drill, rollback runbook, and reproducible live smoke evidence; actual production promotion still requires explicit authorization."
  ],
  "capabilities": [
    {
      "id": "redis-free-platform",
      "title": "Redis-free PostgreSQL platform boundary",
      "priority": 0,
      "status": "production-ready",
      "newApiReference": [
        "New API documents Redis as recommended cache and requires CRYPTO_SECRET for shared Redis."
      ],
    "elygateEvidence": [
      "README.md:291-303",
      "docs/ARCHITECTURE_DECISIONS.md:28-40",
      "scripts/check-new-api-absorption.ts",
      "docs/new-api-absorption.matrix.json",
      "apps/gateway/src/services/postgresxInfra.test.ts",
      "apps/gateway/src/services/localTtlCache.test.ts",
      "apps/gateway/src/services/responseCache.test.ts",
      "apps/gateway/src/services/ratelimit.test.ts",
      "apps/gateway/src/services/batchExecutor.test.ts"
      ],
      "requiredGates": [
        "package manifests scanned for forbidden Redis runtime dependencies",
        "compose files scanned for default Redis services",
        "PostgreSQL-native kernel decision encoded in root check"
      ],
    "verification": [
      "bun run check:new-api-absorption",
      "bun --cwd apps/gateway test:postgresx",
      "bun run check:new-api-production-readiness"
      ],
      "nextActions": [
        "Keep this gate in root check while expanding capabilities."
      ],
      "blockers": []
    },
    {
      "id": "protocol-openai-core",
      "title": "OpenAI core, Responses, image, audio, embeddings, rerank",
      "priority": 1,
      "status": "production-ready",
      "newApiReference": [
        "README.zh_CN.md lists OpenAI-compatible, Responses, Image, Audio, Embeddings, Rerank, and Realtime APIs."
      ],
      "elygateEvidence": [
        "docs/API_STANDARDS.md:5-26",
        "apps/gateway/src/routes/chat.ts",
        "apps/gateway/src/routes/responses.ts",
        "apps/gateway/src/routes/images.ts",
      "apps/gateway/src/routes/audio.ts",
      "apps/gateway/src/routes/embeddings.ts",
      "apps/gateway/src/routes/rerank.ts",
      "apps/gateway/src/routes/protocol-golden.test.ts",
      "apps/gateway/src/routes/chatRoute.test.ts",
      "apps/gateway/src/routes/responsesRoute.test.ts",
      "apps/gateway/src/routes/imagesRoute.test.ts",
      "apps/gateway/src/routes/protocolRouteFamilies.test.ts",
      "apps/gateway/src/services/protocolBilling.ts",
      "apps/gateway/src/services/protocolBilling.test.ts",
      "apps/gateway/src/services/responseCache.test.ts",
      "apps/gateway/src/services/dispatcherCachePolicy.test.ts"
      ],
    "requiredGates": [
      "golden tests for Responses input extraction and OpenAI-compatible Files/Batches serialization",
      "exact response cache tests for disable, hit, miss, ttl storage, and cleanup behavior",
      "route tests for Responses compact and per-response compact routes",
      "image edits and variations passthrough route tests",
      "dispatcher cache policy tests proving streaming, form-data, images, and Responses bypass exact response cache",
      "streaming response status propagation tests",
      "billing and logs side-effect tests for each protocol family"
      ],
      "verification": [
      "bun --cwd apps/gateway check",
      "bun --cwd apps/gateway test:protocol",
      "bun --cwd apps/gateway test:compat",
      "targeted protocol route tests"
      ],
      "nextActions": [
      "Keep protocol route and billing payload tests in the root check path while expanding long-tail provider coverage."
      ],
      "blockers": []
    },
    {
      "id": "files-batches-assistants",
      "title": "Files, Batches, Assistants, Threads, Vector Stores, Fine-tuning Jobs",
      "priority": 1,
      "status": "production-ready",
      "newApiReference": [
        "New API exposes file, batch, and enterprise OpenAI-compatible state-machine surfaces."
      ],
      "elygateEvidence": [
        "docs/API_STANDARDS.md:48-63",
        "apps/gateway/src/routes/files.ts",
        "apps/gateway/src/routes/batches.ts",
      "apps/gateway/src/routes/openai-enterprise.ts",
      "apps/gateway/src/routes/protocolDbSmoke.ts",
      "apps/gateway/src/routes/openaiEnterpriseRouteDbSmoke.ts",
      "scripts/smoke-new-api-protocol-db.ts",
      "scripts/smoke-openai-enterprise-route-db.ts",
      "scripts/smoke-enterprise-db.ts",
      "packages/db/drizzle/20260614010000_add_file_content/migration.sql",
      "packages/db/drizzle/20260614020000_add_assistants_threads_vectorstores/migration.sql",
      "packages/db/drizzle/20260627143228_remove_semantic_cache/migration.sql",
      "apps/gateway/src/services/batchExecutor.ts",
      "apps/gateway/src/services/jobQueue.ts",
      "apps/gateway/src/services/batchExecutor.test.ts",
      "apps/gateway/src/routes/openaiEnterpriseState.test.ts"
      ],
      "requiredGates": [
        "real PostgreSQL smoke for file bytea write/read/delete",
        "direct batch executor smoke with JSONL input and terminal result files",
      "pg-boss queue dispatch tests with claimed validating batches",
        "state-machine tests for assistants, threads, runs, vector stores, and fine-tuning jobs",
        "idempotent migration and rollback notes"
      ],
      "verification": [
        "bun run smoke:new-api:protocol-db",
        "bun run smoke:new-api:enterprise-route-db",
        "bun run smoke:enterprise:db",
      "batch executor integration smoke",
      "bun --cwd apps/gateway test:postgresx"
      ],
      "nextActions": [
      "Keep temporary PostgreSQL route-level smoke and migration rollback notes current as state-machine routes expand."
      ],
      "blockers": []
    },
    {
      "id": "realtime",
      "title": "Realtime API and WebRTC bridge",
      "priority": 2,
      "status": "production-ready",
      "newApiReference": [
        "New API lists OpenAI Realtime API support."
      ],
      "elygateEvidence": [
        "docs/API_STANDARDS.md:25",
        "docs/API_STANDARDS.md:69",
        "apps/gateway/src/routes/realtime.ts",
        "apps/gateway/src/routes/realtimeRoute.test.ts",
      "apps/gateway/src/routes/realtimeBilling.test.ts"
      ],
      "requiredGates": [
      "WebSocket proxy smoke",
      "WebRTC bridge documented as explicit non-goal for the current pinned route-parity target",
      "billing and audit evidence for realtime sessions"
      ],
      "verification": [
        "bun --cwd apps/gateway test:protocol"
      ],
      "nextActions": [
        "Keep the realtime WebSocket proxy smoke and billing/audit helper tests in the protocol suite."
      ],
      "blockers": []
    },
    {
      "id": "provider-task-breadth",
      "title": "Provider breadth and async media/task providers",
      "priority": 2,
      "status": "production-ready",
      "newApiReference": [
        "New API includes Midjourney-Proxy, Suno, Dify, custom upstream, Claude, Gemini, and Rerank references."
      ],
      "elygateEvidence": [
        "docs/API_STANDARDS.md:95-113",
        "apps/gateway/src/providers",
        "apps/gateway/src/providers/providerContracts.test.ts",
        "apps/gateway/src/routes/mj.ts",
        "apps/gateway/src/routes/video.ts",
        "apps/gateway/src/routes/tasks.ts",
        "apps/gateway/src/routes/taskRouteDbSmoke.ts",
        "apps/gateway/src/routes/newApiRelayCompat.test.ts",
        "apps/gateway/src/services/task-service.ts",
        "scripts/smoke-new-api-task-route-db.ts",
        "packages/db/drizzle/20260627172000_replace_tasks_with_generation_runtime/migration.sql"
      ],
      "requiredGates": [
        "provider route contract tests for each enabled provider",
        "async task state stored in PostgreSQL or pg-boss",
        "retry, callback, cancellation, and polling behavior covered",
        "provider secrets redacted in logs and errors"
      ],
      "verification": [
        "bun --cwd apps/gateway test:providers",
        "bun run smoke:new-api:task-route-db"
      ],
      "nextActions": [
        "Keep provider adapter tests and task-route DB smoke evidence current whenever enabled async providers change."
      ],
      "blockers": []
    },
    {
      "id": "operations-routing-admin",
      "title": "Routing, channel health, models, tags, ratios, and admin operations",
      "priority": 1,
      "status": "production-ready",
      "newApiReference": [